<?xml version="1.0" encoding="utf-8"?>
<xs:schema 
  id="report"
  targetNamespace="http://raunstrup.com/EAL"
  elementFormDefault="qualified"
  xmlns="http://raunstrup.com/EAL report.xsd"
  xmlns:mstns="http://raunstrup.com/EAL"
  xmlns:xs="http://www.w3.org/2001/XMLSchema"
>
  <xs:element name="report">
    <xs:complexType>
      <xs:sequence>
        <xs:element name="date" type="xs:date" />
        <xs:element name="hours">
          <xs:complexType>
            <xs:simpleContent>
              <xs:extension base="xs:int">
                <xs:attribute name="type" use="required" />
              </xs:extension>
            </xs:simpleContent>
          </xs:complexType>
        </xs:element>
        <xs:element name="transport">
          <xs:complexType>
            <xs:simpleContent>
              <xs:extension base="xs:int">
                <xs:attribute name="type" use="required" />
              </xs:extension>
            </xs:simpleContent>
          </xs:complexType>
        </xs:element>
        <!--<xs:element name="transport" type="xs:int" />-->
        <xs:element name="materials">
          <xs:complexType>
            <xs:sequence>
              <xs:element name="material" maxOccurs="unbounded">
                <xs:complexType>
                  <xs:simpleContent>
                    <xs:extension base="xs:int">
                      <xs:attribute name="quantity">
                        <xs:simpleType>
                          <xs:restriction base="xs:int">
                            <xs:minExclusive value="0" />
                          </xs:restriction>
                        </xs:simpleType>
                      </xs:attribute>
                    </xs:extension>
                  </xs:simpleContent>
                </xs:complexType>
              </xs:element>
            </xs:sequence>
          </xs:complexType>
        </xs:element>
      </xs:sequence>
      <xs:attribute name="projectId" type="xs:int" use="required" />
      <xs:attribute name="employeeId" type="xs:int" use="required" />
    </xs:complexType>
  </xs:element>
</xs:schema>
